{
  "$schema": "https://json-schema.org/draft/2020-12/schema",
  "$id": "https://schemas.pattertech.eos/claims.schema.json",
  "title": "EOS coordinator-assigned claim set",
  "description": "org/claims.json, assigned by the integrator and committed to the integration branch before worker dispatch. Versioned state, visible from every worktree via git show. There is no live mutable coordination file, no heartbeat field and no check-then-acquire anywhere: lanes receive claims and never acquire or mutate them. A session not named in the committed unexpired set may not create task records or modify product files.",
  "type": "object",
  "additionalProperties": false,
  "required": ["version", "assigned", "lanes"],
  "properties": {
    "version": {
      "type": "integer",
      "minimum": 1
    },
    "assigned": {
      "type": "string",
      "pattern": "^\\d{4}-\\d{2}-\\d{2}$",
      "description": "ISO date the integrator assigned this claim set."
    },
    "lanes": {
      "type": "array",
      "items": { "$ref": "#/$defs/lane" }
    },
    "note": {
      "type": "string",
      "description": "Integrator note: lane intent, merge order, anything the lanes need to know."
    }
  },
  "$defs": {
    "lane": {
      "type": "object",
      "additionalProperties": false,
      "required": [
        "lane_id",
        "task_id",
        "session_id",
        "host",
        "path_claims",
        "acquired",
        "expires"
      ],
      "properties": {
        "lane_id": {
          "type": "string",
          "minLength": 1,
          "description": "For example lane/p4-a1."
        },
        "task_id": {
          "type": "string",
          "pattern": "^T-\\d{4}$"
        },
        "session_id": {
          "type": "string",
          "minLength": 1
        },
        "host": {
          "type": "string",
          "minLength": 1,
          "description": "Liveness identity: the machine the lane runs on. PID checks are only meaningful on the same host."
        },
        "pid": {
          "type": "integer",
          "minimum": 1,
          "description": "Liveness identity for non-harness local sessions."
        },
        "harness_task_id": {
          "type": "string",
          "description": "Liveness identity for harness-dispatched subagent lanes; the harness task state establishes liveness, so no heartbeat writes exist."
        },
        "path_claims": {
          "type": "array",
          "minItems": 1,
          "items": { "$ref": "#/$defs/pathClaim" }
        },
        "acquired": { "$ref": "#/$defs/dateTime" },
        "expires": {
          "$ref": "#/$defs/dateTime",
          "description": "Default 24 hours after acquired. An expired claim is recovered only after liveness is checked; a timestamp alone never authorises concurrent ownership."
        },
        "renewed": {
          "$ref": "#/$defs/dateTime",
          "description": "Set only when a claim came within the renewal window of expiry while the lane was still working."
        }
      }
    },
    "pathClaim": {
      "type": "string",
      "pattern": "^(?![/\\\\])(?!.*\\\\)(?!.*\\.\\.).+$",
      "description": "Repository-relative forward-slash NFC path, compared case-folded. An exact path claims one file; a trailing slash claims the directory prefix. Renames and deletes touch both paths; new files must fall under a claimed prefix; derived files belong to the integrator permanently."
    },
    "dateTime": {
      "type": "string",
      "format": "date-time",
      "pattern": "^\\d{4}-\\d{2}-\\d{2}T\\d{2}:\\d{2}"
    }
  }
}
